{"$schema":"https://json-schema.org/draft/2020-12/schema","$id":"https://rot.dev/schemas/survival-checkpoint.v2.schema.json","title":"SurvivalCheckpointV2","type":"object","additionalProperties":false,"required":["schema_version","checkpoint_id","project_id","workstream_id","objective_id","agent_id","session_id","observed_source_sha","event_watermark","authority_state","completed","blockers","next_actions","resume_recipe","checkpoint_hash"],"properties":{"schema_version":{"const":"2"},"checkpoint_id":{"type":"string","minLength":1,"maxLength":256},"parent_checkpoint_id":{"type":["string","null"],"maxLength":256},"project_id":{"type":"string","minLength":1,"maxLength":256},"workstream_id":{"type":"string","minLength":1,"maxLength":256},"objective_id":{"type":"string","minLength":1,"maxLength":256},"agent_id":{"type":"string","minLength":1,"maxLength":256},"session_id":{"type":"string","minLength":1,"maxLength":256},"observed_source_sha":{"description":"Semantic authority revision observed when the checkpoint was compiled. The checkpoint artifact commit itself is tracked externally and must not be self-referential.","type":"string","pattern":"^[0-9a-f]{40}$"},"event_watermark":{"type":"integer","minimum":0},"projection_hash":{"type":["string","null"],"pattern":"^sha256:[0-9a-f]{64}$"},"context_pack_hash":{"type":["string","null"],"pattern":"^sha256:[0-9a-f]{64}$"},"authority_state":{"enum":["PROPOSED","IMPLEMENTED","EXECUTED","VERIFIED","EMPIRICALLY_QUALIFIED","BLOCKED","DEGRADED_EXTERNAL","SUPERSEDED"]},"completed":{"type":"array","items":{"type":"string","maxLength":1024},"maxItems":256},"changed_paths":{"type":"array","items":{"type":"string","maxLength":1024},"maxItems":512,"uniqueItems":true},"decisions":{"type":"array","items":{"type":"string","maxLength":256},"maxItems":256,"uniqueItems":true},"tests":{"type":"array","items":{"type":"object","additionalProperties":false,"required":["test_id","status","source_sha"],"properties":{"test_id":{"type":"string","minLength":1,"maxLength":256},"status":{"enum":["PASS","FAIL","SKIPPED","CANCELLED","NOT_RUN"]},"source_sha":{"type":"string","pattern":"^[0-9a-f]{40}$"},"run_id":{"type":["string","null"],"maxLength":256},"evidence_hash":{"type":["string","null"],"pattern":"^sha256:[0-9a-f]{64}$"}}},"maxItems":512},"evidence":{"type":"array","items":{"type":"string","maxLength":512},"maxItems":512,"uniqueItems":true},"blockers":{"type":"array","items":{"type":"string","maxLength":1024},"maxItems":256},"risks":{"type":"array","items":{"type":"string","maxLength":1024},"maxItems":256},"graph_delta":{"type":"array","items":{"type":"string","maxLength":1024},"maxItems":512},"task_delta":{"type":"array","items":{"type":"string","maxLength":1024},"maxItems":512},"refactor_debt":{"type":"array","items":{"type":"string","maxLength":1024},"maxItems":256},"next_actions":{"type":"array","minItems":1,"maxItems":32,"items":{"type":"string","maxLength":1024}},"resume_recipe":{"type":"array","minItems":1,"maxItems":32,"items":{"type":"string","maxLength":1024}},"checkpoint_hash":{"type":"string","pattern":"^sha256:[0-9a-f]{64}$"}}}