{"schema_version":"2","checkpoint_id":"rot://checkpoint/agentic-os/cp4-reference-20260829","parent_checkpoint_id":null,"project_id":"rot://project/agentic-os","workstream_id":"rot://workstream/agentic-os/graph-refactor-v2-survival","objective_id":"rot://objective/agentic-os/survival-v2-cp4","agent_id":"rot://agent/chatgpt/graph-refactor-v2-architect","session_id":"rot://session/chatgpt/graph-refactor-v2/20260829T2118+0200","observed_source_sha":"015abe49353f744269d10cec7f7d3778a46e963c","event_watermark":0,"projection_hash":null,"context_pack_hash":null,"authority_state":"VERIFIED","completed":["CP0 live topology reconciled","CP1 ontology and lexicon frozen","CP2 historical regression and gap matrix compiled","CP3 Survival V2 architecture frozen for shadow candidate","CP4 Python reference survival reducer/freshness/checkpoint/death-drill layer implemented and exact-head verified"],"changed_paths":[".github/workflows/f1-parity-ci.yml",".github/workflows/f1-rust-ci.yml","AGENTS.md","README.md","STATE.md","TASKS.md","adr/ADR-0002-survival-v2-convergence.md","docs/AGENT_SURVIVAL_PROTOCOL_V2.md","docs/ARCHITECTURE_V2.md","docs/ASSURANCE_RECOVERY_MIGRATION_V2.md","docs/GAP_MATRIX_V2.md","docs/LEXICON.md","graph/ONTOLOGY_V2.md","graph/projection_manifest.json","plans/GRAPH_REFACTOR_V2_IMPLEMENTATION.md","prompts/GRAPH_REFACTOR_V2.md","python/rot_contracts/survival.py","python/tests/test_survival_schema_v2.py","python/tests/test_survival_v2.py","schemas/survival-checkpoint.v2.schema.json","schemas/survival-project-state.v2.schema.json","state/project_state.json","templates/HANDOFF.md"],"decisions":["rot://decision/agentic-os/survival-stacks-on-f1","rot://decision/agentic-os/projections-never-authority","rot://decision/agentic-os/observed-source-sha-not-self-head"],"tests":[{"test_id":"f1-rust-contract-kernel","status":"PASS","source_sha":"6f2c74a1471a6af336c1df3318cab49884291189","run_id":"33271402509","evidence_hash":null},{"test_id":"f1-cross-language-parity-plus-survival-python","status":"PASS","source_sha":"6f2c74a1471a6af336c1df3318cab49884291189","run_id":"33271402511","evidence_hash":null},{"test_id":"survival-rust-ts-python-parity","status":"NOT_RUN","source_sha":"6f2c74a1471a6af336c1df3318cab49884291189","run_id":null,"evidence_hash":null},{"test_id":"cos-projection-rebuild-parity","status":"NOT_RUN","source_sha":"6f2c74a1471a6af336c1df3318cab49884291189","run_id":null,"evidence_hash":null},{"test_id":"synthetic-zero-context-agent-death-drill","status":"NOT_RUN","source_sha":"6f2c74a1471a6af336c1df3318cab49884291189","run_id":null,"evidence_hash":null}],"evidence":["github-actions:33271402509","github-actions:33271402511","pr:3"],"blockers":["survival cross-language parity not implemented","COS projection rebuild parity not implemented","claims/concurrency kernel not implemented","ContextPack invalidation runtime not implemented","synthetic <=5 minute zero-context death drill not executed","TypeScript package has no lockfile"],"risks":["external CP01/CP02/CP03 governance references are not yet revision-pinned in this repository"],"graph_delta":["added Survival V2 typed ontology and COS projection activation map","established Session/Checkpoint/Authority/Decision/Test/Evidence nodes as first-class model","marked unused COS dimensions NOT_APPLICABLE instead of forcing symmetry"],"task_delta":["SV2-001 exact-head combined CP4 verification achieved at code head 6f2c74a","SV2-003 cross-language survival parity is next critical task","SV2-005 COS projection follows contract parity"],"refactor_debt":["generate pnpm lockfile or otherwise pin TypeScript transitive dependency resolution","revision-pin external governance references","build canonical truth consistency gate once state/event reducer is authoritative"],"next_actions":["implement Rust/TypeScript/Python Survival V2 golden parity","implement reference accepted-event store/replay snapshots","implement one-way COS projection and deterministic rebuild parity","implement claims/barriers then ContextPack invalidation","execute synthetic zero-context death drill"],"resume_recipe":["read AGENTS.md and prompts/GRAPH_REFACTOR_V2.md","reconstruct live main and PR #3 head before using this checkpoint","verify latest CI belongs to current PR #3 head","treat this checkpoint as CP4 reference evidence only","continue with SV2-003 unless live scopes or authority changed"],"checkpoint_hash":"sha256:71dd3fa32567f10d46eeb314d758ca348c128ebf32e5e1dd8354631156b30aa2"}